{
  "manifestVersion": 1,
  "evidenceProfile": {
    "id": "h3-2c2-legacy-agent-run-recovery",
    "version": 1,
    "sourceKind": "referenced-compatibility-fixtures",
    "productionEvidence": "agent-run-loader-snapshot-persistence-v1"
  },
  "persistedV5CoreFields": [
    "version", "id", "sessionId", "cwd", "workspaceRoots", "clientRequestId", "runKind",
    "parentAgentRunId", "parentToolCallId", "agentDepth", "status", "resumeStatus",
    "permissionProfile", "error", "errorCode", "nonActionCount", "forceFinalRound",
    "forceFinalReason", "contextLimit", "contextWindowTokens",
    "contextBudgetTokens", "contextWindowSource", "contextWindowHard",
    "availableInputTokens", "compressionTriggerTokens", "budgetClamped",
    "budgetAboveEstimate", "calibrationCapTokens", "calibrationEvidenceKind",
    "calibrationExpiresAt", "calibrationApplied", "contextRecoveryRound", "request",
    "messages", "tools", "toolBudgets", "rounds", "compactions", "pendingToolCalls",
    "pendingInput", "pendingAuthorization", "pendingSteers", "steerReceipts",
    "toolExecutions", "usage", "result", "events", "nextSeq", "maxRounds",
    "createdAt", "updatedAt"
  ],
  "cases": [
    {
      "name": "agent-run-v1",
      "sourceFixture": "compatibility/agent-run-v1.json",
      "sourceCanonicalSha256": "a2bed1af692366f4af3f21f1b41bba7f09cccac4456da57e93e193a0c5345598",
      "sourceRecordVersion": 1,
      "missingFields": [
        "cwd", "workspaceRoots", "clientRequestId", "runKind", "parentAgentRunId", "parentToolCallId",
        "agentDepth", "permissionProfile", "errorCode", "nonActionCount", "forceFinalRound",
        "forceFinalReason", "contextLimit", "contextWindowTokens", "contextBudgetTokens",
        "contextWindowSource", "contextWindowHard", "availableInputTokens",
        "compressionTriggerTokens", "budgetClamped", "budgetAboveEstimate",
        "calibrationCapTokens", "calibrationEvidenceKind", "calibrationExpiresAt",
        "calibrationApplied", "contextRecoveryRound", "toolBudgets",
        "compactions", "pendingInput", "pendingAuthorization", "pendingSteers", "steerReceipts"
      ],
      "expected": {
        "loader": {"fields": {
          "status": "waiting_credentials", "resume_status": "tools", "client_request_id": "",
          "parent_agent_run_id": "", "parent_tool_call_id": "", "agent_depth": 0,
          "permission_profile": "read", "error_code": "", "non_action_count": 0,
          "force_final_round": false, "force_final_reason": "", "context_limit": 128000,
          "context_recovery_round": 0, "pending_steers": [], "pending_input_present": false,
          "steer_receipt_count": 0, "compaction_count": 0, "next_seq": 1, "max_rounds": 4
        }},
        "snapshot": {"fields": {
          "status": "waiting_credentials", "clientRequestId": "", "parentAgentRunId": "",
          "parentToolCallId": "", "agentDepth": 0, "permissionProfile": "read",
          "errorCode": "", "nonActionCount": 0, "forceFinalRound": false,
          "contextLimit": 128000, "round": 0, "pendingSteerCount": 0,
          "pendingInputPresent": false, "steerReceiptCount": 0, "compactionCount": 0,
          "nextCursor": 0
        }},
        "persisted": {"fields": {
          "version": 5, "status": "waiting_credentials", "resumeStatus": "tools",
          "clientRequestId": "", "parentAgentRunId": "", "parentToolCallId": "",
          "agentDepth": 0, "permissionProfile": "read", "errorCode": "",
          "nonActionCount": 0, "forceFinalRound": false, "forceFinalReason": "",
          "contextLimit": 128000, "contextRecoveryRound": 0, "pendingSteers": [],
          "pendingInputPresent": false, "steerReceiptCount": 0, "compactionCount": 0,
          "nextSeq": 1
        }},
        "disk": {
          "firstLoadStatus": "waiting_credentials",
          "firstLoadEventTypes": ["waiting_credentials"],
          "firstLoadNextSeq": 2,
          "firstLoadNextCursor": 1,
          "restartEvents": [{"type": "waiting_credentials", "reason": "server_restarted", "resumeStatus": "tools"}],
          "cacheHitSameObject": true,
          "sessionIndexBeforePersist": true,
          "nonterminalIndexBeforePersist": true,
          "persistedVersion": 5,
          "secondLoadStatus": "waiting_credentials",
          "secondLoadEventTypes": ["waiting_credentials"],
          "secondLoadNextSeq": 2,
          "secondLoadNextCursor": 1,
          "sessionIndexAfterSecondLoad": true,
          "nonterminalIndexAfterSecondLoad": true,
          "publicSnapshotStable": true,
          "persistedRecordStable": true
        }
      }
    },
    {
      "name": "agent-run-v2",
      "sourceFixture": "compatibility/agent-run-v2.json",
      "sourceCanonicalSha256": "890db5b3840b5bd2ffb2d0f4ac5f1cc0611865debf981a87fa29f3a32fd8cc66",
      "sourceRecordVersion": 2,
      "missingFields": [
        "clientRequestId", "runKind", "parentAgentRunId", "parentToolCallId", "agentDepth",
        "nonActionCount", "forceFinalRound", "forceFinalReason", "contextLimit",
        "contextWindowTokens", "contextBudgetTokens", "contextWindowSource",
        "contextWindowHard", "availableInputTokens", "compressionTriggerTokens",
        "budgetClamped", "budgetAboveEstimate", "calibrationCapTokens",
        "calibrationEvidenceKind", "calibrationExpiresAt", "calibrationApplied",
        "contextRecoveryRound", "compactions", "pendingSteers", "steerReceipts"
      ],
      "expected": {
        "loader": {"fields": {
          "status": "waiting_user_input", "resume_status": "", "client_request_id": "",
          "parent_agent_run_id": "", "parent_tool_call_id": "", "agent_depth": 0,
          "permission_profile": "read", "error_code": "", "non_action_count": 0,
          "force_final_round": false, "force_final_reason": "", "context_limit": 1000000,
          "context_recovery_round": 0, "pending_steers": [], "pending_input_present": true,
          "steer_receipt_count": 0, "compaction_count": 0, "next_seq": 1, "max_rounds": 4
        }},
        "snapshot": {"fields": {
          "status": "waiting_user_input", "clientRequestId": "", "parentAgentRunId": "",
          "parentToolCallId": "", "agentDepth": 0, "permissionProfile": "read",
          "errorCode": "", "nonActionCount": 0, "forceFinalRound": false,
          "contextLimit": 1000000, "round": 0, "pendingSteerCount": 0,
          "pendingInputPresent": true, "steerReceiptCount": 0, "compactionCount": 0,
          "nextCursor": 0
        }},
        "persisted": {"fields": {
          "version": 5, "status": "waiting_user_input", "resumeStatus": "",
          "clientRequestId": "", "parentAgentRunId": "", "parentToolCallId": "",
          "agentDepth": 0, "permissionProfile": "read", "errorCode": "",
          "nonActionCount": 0, "forceFinalRound": false, "forceFinalReason": "",
          "contextLimit": 1000000, "contextRecoveryRound": 0, "pendingSteers": [],
          "pendingInputPresent": true, "steerReceiptCount": 0, "compactionCount": 0,
          "nextSeq": 1
        }},
        "disk": {
          "firstLoadStatus": "waiting_user_input",
          "firstLoadEventTypes": [],
          "firstLoadNextSeq": 1,
          "firstLoadNextCursor": 0,
          "restartEvents": [],
          "cacheHitSameObject": true,
          "sessionIndexBeforePersist": true,
          "nonterminalIndexBeforePersist": true,
          "persistedVersion": 5,
          "secondLoadStatus": "waiting_user_input",
          "secondLoadEventTypes": [],
          "secondLoadNextSeq": 1,
          "secondLoadNextCursor": 0,
          "sessionIndexAfterSecondLoad": true,
          "nonterminalIndexAfterSecondLoad": true,
          "publicSnapshotStable": true,
          "persistedRecordStable": true
        }
      }
    },
    {
      "name": "agent-run-v3",
      "sourceFixture": "compatibility/agent-run-v3.json",
      "sourceCanonicalSha256": "f5e0279652b4aea71abf2f1447a87578b7201caff3519bba43f70bc77df7470a",
      "sourceRecordVersion": 3,
      "missingFields": [
        "runKind", "parentAgentRunId", "parentToolCallId", "agentDepth", "nonActionCount",
        "forceFinalRound", "forceFinalReason", "contextWindowTokens",
        "contextBudgetTokens", "contextWindowSource", "contextWindowHard",
        "availableInputTokens", "compressionTriggerTokens", "budgetClamped",
        "budgetAboveEstimate", "calibrationCapTokens", "calibrationEvidenceKind",
        "calibrationExpiresAt", "calibrationApplied", "pendingSteers", "steerReceipts"
      ],
      "expected": {
        "loader": {"fields": {
          "status": "completed", "resume_status": "", "client_request_id": "client-fixture-v3",
          "parent_agent_run_id": "", "parent_tool_call_id": "", "agent_depth": 0,
          "permission_profile": "read", "error_code": "", "non_action_count": 0,
          "force_final_round": false, "force_final_reason": "", "context_limit": 200000,
          "context_recovery_round": 1, "pending_steers": [], "pending_input_present": false,
          "steer_receipt_count": 0, "compaction_count": 1, "next_seq": 2, "max_rounds": 4
        }},
        "snapshot": {"fields": {
          "status": "completed", "clientRequestId": "client-fixture-v3", "parentAgentRunId": "",
          "parentToolCallId": "", "agentDepth": 0, "permissionProfile": "read",
          "errorCode": "", "nonActionCount": 0, "forceFinalRound": false,
          "contextLimit": 200000, "round": 1, "pendingSteerCount": 0,
          "pendingInputPresent": false, "steerReceiptCount": 0, "compactionCount": 1,
          "nextCursor": 1
        }},
        "persisted": {"fields": {
          "version": 5, "status": "completed", "resumeStatus": "",
          "clientRequestId": "client-fixture-v3", "parentAgentRunId": "", "parentToolCallId": "",
          "agentDepth": 0, "permissionProfile": "read", "errorCode": "",
          "nonActionCount": 0, "forceFinalRound": false, "forceFinalReason": "",